College Name,Contact no,Email,Website,Address
"Peoples Co-operative Arts and Science college Contact Number, Address & Location Map, Kasaragod",04994 207080 Em,kcesltdmunnad@gmail.com,http://www.peoplescollege.edu.in/contact_us.php,"Kasargod Co-Operative Educational Society Ltd,Munnad ,Munnad P.O,Chengala (Via), Kasaragod, Kerala, PIN-671541"
"School of Hospitality and Tourism - Bahra University Contact Number, Address & Location Map, Solan",9805092461,bahrauniversity@rayatbahra.com,http://www.bahrauniversity.edu.in/HM.html,NH22WaknaghatHimachal Pradesh 173234
"K L U Business School Contact Number, Address & Location Map, Guntur",0866-2577715,klubs@gmail.com,http://www.kluniversity.in/mba/default.aspx,K L UniversityGreen FieldsVaddeswaramGuntur DistrictA.P.INDIA. Pincode : 522 502.
"KLU Department of Hotel Management Contact Number, Address & Location Map, Guntur",pavan1984@kluniversity.in,http://www.kluniversity.in/bhm/default.aspx,KL university GreenfieldsVaddeswaram-522 502 Guntur District Andrapradeh India Nearest Station-Vijaywada
"DBRAIT Port Blair Contact Number, Address & Location Map, Port Blair",03192 259 693,dbrait.and@nic.in,http://dbrait.andaman.gov.in/,Polytechnic RoadPahargaonJunglighatPort BlairAndaman and Nicobar Islands 744103
"Holy Cross College of Management & Technology Contact Number, Address & Location Map, Idukki",91-4868-277674,http://www.holycrossputtady.org/,"Puttady, Idukki. Kerala - 685 551"
"JPM College of Arts & Science Contact Number, Address & Location Map, Idukki",04868 259 061,cstjpmcollege@gmail.com,http://www.jpmcollege.com/web/index.php?cameca=0,"JPM Educational Institutions,Kanchiyar P.O., Labbakkada,Dist. Idukki , Kerala.PIN 685511"
"V.O. Chidambaram College Contact Number, Address & Location Map, Thoothukudi",2310275,veeocee@sancharnet.in,http://www.voccollege.ac.in/index.html,"Thoothukudi - 628008,Tamilnadu, india."
"JS Amroha Contact Number, Address & Location Map, Amroha",jscollege_amroha@yahoo.in,http://www.jshpgcollege.com/,"Azad road, Amroha, Uttar Pradesh 244221"
"Siena College Of Professional Studies Contact Number, Address & Location Map, Kochi",(0)484 - 232784,sienacollegemail@gmail.com,http://www.sienacollege.co.in/Siena.html,"Edacochin,Kerala, South India,PIN - 682 010"
"Govinda Pai Memorial Govt College Contact Number, Address & Location Map, Kasaragod",04998 272 670,gpmgcmjr@bsnl.com,http://gpmgcollege.in/aboutus.php,"Manjeshwar P.O., Kasaragod district, Kasaragod, Kerala 671323"
"KVVS College of Science & Technology Contact Number, Address & Location Map, Adoor",04734 - 241398,kvvs_cst@yahoo.com,http://www.kvvscst.com/,"Kaithaparambu P.O, Ezhamkulam,Adoor, Kerala, Pin: 691 526"
"Sau. KSK ( Kaku ) College Of Food Technology Contact Number, Address & Location Map, Beed",+91-9422743572,kskcft@gmail.com,http://kskcft.org/,"Mhasoba Phata, Nagar Road, Beed -431122 (M.S) India."
"Swayam Sankalp Bahuuddeshiya Sanstha College of Management Studies Contact Number, Address & Location Map, Ahmednagarv",0241-2431872,ssbscms@ymail.com,"SSBS College of Management Studies,Amar Hotel Complex,Laltaki Road,Ahmednagar."
"Regal College of Technology (RCT), Raigarh(Mh) Contact Number, Address & Location Map, Raigarh(Mh)",(02145) 222181,regalcollegemahad@gmail.com,http://www.regalcollege.in/mahad.html,"At-Kunbi Bhavan, Near St Depot,Mahad, Dist- Raigad"
"Bharathiar University Arts and science College (BUASC), Gudalur Contact Number, Address & Location Map, Gudalur",04262 - 265005,http://www.b-u.ac.in/colleges/affiliatedcolleges.asp?cCode=999,"Amaikulam, Puliam Parai P.O., Gudalur - 643 212"
"Gurudev Arts & Science College Contact Number, Address & Location Map, Kannur",info@gurudevcollege.org,http://www.gurudevcollege.org/,"P. O. Mathil, Payyannur,Kannur District PIN-670343"
"Sharaf Arts & Science College Contact Number, Address & Location Map, Kasaragod",mail@sharafcollege.com,http://www.sharafcollege.com/,"Near Co-op bank Via- Cheruvathur Padne (P.O), Kasaragod , Kerala, India,  PIN 671312"
"Lourdes Matha Institute of Hotel Management and Catering Technology Contact Number, Address & Location Map, Thiruvananthapuram",0091-0472-28533,info@lmihmct.org,http://www.lmihmct.org/,"Kuttichal, Thiruvananthapuram, Kerala(State), India – 695 574"
"St.John Institute of Hospitality and Catering Technology Contact Number, Address & Location Map, Palghar",+91 2525 256486,sjihct.aldel@rediffmail.com,http://www.sjihct.in/,"St. John Technical Education Complex,Village Vevoor, Manor Road, Palghar (E),District - Palghar ,Maharashtra,401 404"
"Sanskriti Institute of Hotel Management Contact Number, Address & Location Map, Mathura",07500723300,consultinnhm@gmail.com,http://www.sanskritiinstitutions.net/,28 K. M. StoneNH.-2Mathura - Delhi HighwayChhataDistt. Mathura (U.P.)
"Suretech College of Hospitality Management Contact Number, Address & Location Map, Nagpur",info@suretech-chm.org,http://suretechgroup.com/hospitality/about_us.html,"Survey No. : 120/2K,Ashokvan, Jamtha Wardha Road,Nagpur."
"AIIHM Hotel Management Institute (AIIHMHMI), Greater Noida Contact Number, Address & Location Map, Greater Noida",0120-2322153,info@aiihm.in,http://www.aiihm.in/,"39C, Knowledge Park I, Greater Noida, ( U.P ). India"
"Arabinda Basu Institute of Hotel Management (ABIHM), Kolkata Contact Number, Address & Location Map, Kolkata",033-64561044,sbasuinstitute@yahoo.in,http://www.abihm.com/,"""PARUL PALACE"" 84/4A, Satyen Roy Road, 2nd Floor, Kolkata-700034. (Near Behala Tram Depot)"
"Consult inn, Institute of Hotel Management Contact Number, Address & Location Map, Kottayam",0481-2564131,consultinnhm@gmail.com,http://www.consultinn.com/consultinn/index.php,"Opp: Adam towers, Kottayam - 686 039, KERALA, INDIA"
"Konark College of Hotel Management & Tourism Contact Number, Address & Location Map, Sikar",Info@konarkcollege.com,http://www.konarkcollege.com/,"Aasharm Marg , Near Friend Hotel, Jaipur Road ,Sikar"
"Valluvar College of Science and Management Contact Number, Address & Location Map, Karur",04324-646049,valluvarcollege@gmail.com,http://vcsm.ac.in,"New Madurai Bye-Pass Road, Puthambur(Post), Karur-639 003."
"Landmark Foundation Institute of Management And Technology Contact Number, Address & Location Map, Dehradun",7500335000,info@lmfdoon.com,http://www.lmfdoon.com/,Landmark Foundation Institute of Management & TechnologyC 64 Nehru Colony Near Custom & Excise Office Dehradun Uttarakhand - 248001
"Darjeeling Universal Campus Contact Number, Address & Location Map, Darjeeling",+91-9073302665,admissions@duc.edu.in,http://www.duc.edu.in,"Takdah Cantonment, Near Sericulture, Darjeeling, W Bengal, India, Pin- 734222"
"ABI & ABI College of Arts, Science & Technology (ABIABICAST), Thanjavur Contact Number, Address & Location Map, Thanjavur",04362  253555,info@abiabi.org,http://abiabi.org/abi-abi-college.php,"Kumbakonam Main Road, Vayalur,Thanjavur – 613004, Tamil Nadu, INDIA"
"National Institute of Learning and Academics Contact Number, Address & Location Map, Gurgaon",info@nila.org.in,http://www.nila.edu.in/,NILAP-135Institutional Area Sector - 44Gurgaon.
"SIMT Lucknow Contact Number, Address & Location Map, Lucknow","0522-2818654, +91-8176001833, +91-6389369826",managingdirector.simt@gmail.com,http://www.simtlucknow.com/,"Chinhat Dewa Rd, Industrial Area Near New RTO Office, Lucknow"
"H.K. Hi-Tech College Contact Number, Address & Location Map, Jodhpur",0291-2640559,hkhcollegejodhpur@gmail.com,http://www.hkhcollege.com/index.php,"199, 1st 'C' Road, Sardarpura,Jodhpur - 342 003 (Raj.) INDIA"
"SNGM Arts and Science college Contact Number, Address & Location Map, Alappuzha",0478 2560415,college@sngmc.org,http://www.sngmc.org/arts_science.html,"Valamangalam South P.O., Thuravoor, Cherthala, Alappuzha, Kerala-688532"
"Alva s Homoeopathic Medical College (AHMC), Dakshina Kannada Contact Number, Address & Location Map, Dakshina Kannada",262189,ahmc@alvas.org,http://alvashomoeopathic.com/index.php,"NH-13, Shobhavana Campus, Thenkamijar Moodnidri- 574225, Taluk: Mangalore, Dist.: Dakshin Kannada, Karnataka."
"Arya PG College Contact Number, Address & Location Map, Panipat",+91-0180-269573,principal@aryapgcollege.com,http://www.aryapgcollege.com/page.php?page=principal_desk,"Opposite Bus Stand, Panipat, Haryana."
"Mannaniya College of Arts & Science Contact Number, Address & Location Map, Thiruvananthapuram",0472-869210,http://mannaniyacollege.ac.in/,"Thiruvanathapuram, Kerala, India - 695609"
"Government Polytechnic Jammu Contact Number, Address & Location Map, Jammu",91-191-2435373,govtpolyjammu@gmail.com,http://www.govtpolytechnicjammu.edu.in/,"Opposite Kala Kendra, Bikram Chowk, Jammu (J&K)"
"State Institute Of Food Processing & Technology Contact Number, Address & Location Map, Lucknow",+91-522-2623301,info@sifptup.in,http://sifptup.in/about.html,"18- B, Ashok Marg,Lucknow,India"
"Department of Commerce Contact Number, Address & Location Map, Manipal",doc.office@manipal.edu,http://manipal.edu/doc.html,"Department of Commerce,New Management Block,Near 9th Block,MIT Hostel,MIT Campus,Manipal, India."
"Kamala Degree College Contact Number, Address & Location Map, Lakhimpur",9235728508,kdclmp1220@gmail.com,http://kamladegreecollege.org/index.aspx,"Kamla Degree College , Kashi Nagar, Deoapur Lakhimpur KHeri (U.P.) 262701"
"Jawaharlal Nehru Rajkeeya Mahavidyalaya Contact Number, Address & Location Map, Port Blair",0413-2655991,prodesk@pu.pon.nic.in,http://jnrm.and.nic.in,Jawaharlal Nehru Rajkeeya MahavidyalayaPortblair
"LBS Kota Contact Number, Address & Location Map, Kota",+91-7420899222,admission@lbsacademy.edu.in,http://www.bscollegekota.com/,"SECTOR 1ST Mahaveer Nagar Extn., Kota Rajasthan"
"Sushant University Contact Number, Address & Location Map, Gurgaon",+91-18002705520,admissions@sushantuniversity.edu.in,http://www.sushantuniversity.edu.in,"Sector 55, Golf Course Road,Gurgaon - 122003 (Haryana)"
"SMC Shillong Contact Number, Address & Location Map, Shillong",principal@smcs.ac.in,http://smcs.ac.in/,Saint Mary's CollegeLaitumkhrahShillong.Meghalaya. India - 793003
"Govt Medical College Contact Number, Address & Location Map, Srinagar",01942504114,principal_dean@gmcs.edu.in,http://www.gmcs.edu.in/,"Karan Nagar, Srinagar, Jammu and Kashmir 190010"
"Alipurduar College Contact Number, Address & Location Map, Jalpaiguri",+91-3564-255045,alipurduarcollege@gmail.com,http://www.apdcollege.org,Alipurduar CollegeAlipurduar CourtDist.: AlipurduarPIN : 736122West BengalIndia.
"Government Polytechnic Uttarkashi Contact Number, Address & Location Map, Kheri",0174-222240,principalgpu@ymail.com,http://www.gputtarkashi.org.in/,Disst. : Uttarkashi  Uttarkhand-249193
"GIHM Almora Contact Number, Address & Location Map, Almora",254256,gihmalmora@gmail.com,http://gihmalmora.com/institute.htm,"Chilkapita, Khatiyari, Almora – 263601 (Uttarakhand)"
"Guru Nanak Education Trust (Hermes College of Engineering) Contact Number, Address & Location Map, Roorkee",01334-398700,info@gurunanakeducation.com,http://www.hermeseducation.com/,"Vill. Kheri Shikohpur,(Near Chhutmalpur, PS Fatehpur),Dehradun Road, Roorkee,Distt. Haridwar - 247662"
"Jaya College of Arts & Science Contact Number, Address & Location Map, Kanchipuram","+91-044-26390808 ,+91-44-26300251",info@jcas.co.in,http://www.jcas.co.in/index.html,"Jaya College of Arts & Science,CTH Road, Thiruninravur,Chennai- 602 024."
"St. Joseph s College of Arts and Science Contact Number, Address & Location Map, Chennai",044 24780 121,oseph_dmi@yahoo.co.in,http://www.stjosephcollege.in/,"ST.JOSEPH’S COLLEGE (ARTS & SCIENCE),	KUNDRATHUR HIGH ROAD, 	KOVUR, CHENNAI-600 122."
"Shankarrao Mohite Mahavidyalaya Contact Number, Address & Location Map, Solapur",02185   223780,smmakj@yahoo.com,http://www.smmakluj.com/,"Shankarrao Mohite Mahavidyalaya, Akluj,Akluj (Malewadi),Tal: Malshiras,Dist: Solapur ,Pin: 413101"
"Government Polytechnic (GP), Shimoga Contact Number, Address & Location Map, Shimoga",08184-272539,govtpoly_sorab@rediffmail.com,http://gptsorab.in/,Next to Govt. HospitalSagar RoadSorab talukShimoga (D) -577429
"Guru Kripa Industrial Training Industrial Contact Number, Address & Location Map, Tonk",info@gurukripaiti.com,http://gurukripaiti.com/about/who-are-we.php,"Near Rani Laxmibai Girls Collage, Khandevat Road, Newai, Dist - Tonk (Raj.),India"
"Amity University Online Contact Number, Address & Location Map, Noida",http://www.amityonline.com/,"Sector 125, Noida, Uttar Pradesh 201313"
"Satyam International Polytechnic Contact Number, Address & Location Map, New Delhi",011-27313042,satyampolytechnic@yahoo.in,http://www.satyaminternationalpolytechnic.com,"GD Block, Pitam Pura (Near Pitampura Metro Station),  New Delhi- 110034 (India)"
"CKD Institute of Management and Technology Contact Number, Address & Location Map, Amritsar",0183-2560148,ckdimt_asr@chiefkhalsadiwan.com,http://www.ckdimt.org/ckdcollege/aspxpages/Index/HomePage.aspx,"CKD Institute of Management and Technology,Opp. Model Town, Near Railway Station,G.T. Road, Amritsar"
"Devs Homoeopathic Medical College Contact Number, Address & Location Map, Hyderabad",http://devshomoeopathy.com/,"Devanagar, Ankireddypalli,, Keesara - Bommalaramaram Rd, Keesara, Telangana 501301"
"The ICFAI University (ICFAI), West Garo Hills Contact Number, Address & Location Map, West Garo Hills",03651-224683/84,admissions@iumeghalaya.edu.in,http://www.iumeghalaya.edu.in/index.html,DanakgrePO AraimileTura 794101West Garo Hills Meghalaya
"ICFAI University Sikkim Contact Number, Address & Location Map, Gangtok",982041860,registrar@iusikkim.edu.in,http://www.iusikkim.edu.in/Contact.aspx,"Ranka Road, Lower Sichey,,    Gangtok, Sikkim - 737101."
"Assam Homoeopathic Medical College & Hospital (AHMCH), Nagaon Contact Number, Address & Location Map, Nagaon",03672223734,ahmcnagaon@yahoo.com,http://ahmch.org/pages/about.php,"Assam Homoeopathic Medical College And Hospital ,Locality :Lakhi Nagar ,Post Office: Haibargaon ,District : Nagaon ,State: Assam ,Pin No: 782002"
"GNIHM Kolkata Contact Number, Address & Location Map, Kolkata",hr@jisgroup.org,http://www.gnihm.ac.in
"GD Goenka University Contact Number, Address & Location Map, Gurgaon",+91-8800992022,info@gdgoenka.ac.in,https://www.gdgoenkauniversity.com/,"G D Goenka Education City Sohna Gurgaon Road Sohna, Haryana India"
"Vivekananda Global University Contact Number, Address & Location Map, Jaipur",+91 141 285 1000,info@vgu.ac.in,http://www.vgu.ac.in,"Sector 36, Sisyawas, NRI Road, Jagatpura, Jaipur - 303 012 Rajasthan"
"JECRC University Contact Number, Address & Location Map, Jaipur",18001205616,admission@jecrcu.edu.in,http://www.jecrcuniversity.edu.in,"Plot No. IS-2036 to IS-2039 Ramchandrapura Industrial Area Jaipur, Sitapura, Vidhani, Rajasthan 303905"
"Acharya Institutes (AI, Ai Bangalore), Bangalore Contact Number, Address & Location Map, Bengaluru",+91-80-2372 2222,admission@acharya.ac.in,http://www.acharya.ac.in,"Acharya Dr. Sarvepalli Radhakrishnan Road Acharya PO, Soladevanahalli Bangalore-560 107, India"
"Ajeenkya DY Patil University (ADYPU), Pune Contact Number, Address & Location Map, Pune","+91-2067077942/43, +91-8686868686, +91-7676767676",info@adypu.edu.in,http://www.adypu.edu.in,"DY Patil Knowledge City Road Via Lohgaon, Airport Rd, Charholi Budruk, Pune, Maharashtra 412105"
"T. John Group of Institutions Contact Number, Address & Location Map, Bengaluru","+91-8049030555, +91-8040250555, +91-9113264915",campus@tjohncollege.com,http://www.tjohncollege.com,"No. 88/1, Gottigere  Bannerghatta Road, Bangalore,  Karnataka 560 083, India."
"Pragati School of Management Contact Number, Address & Location Map, Guwahati","+91-98540 09886 , 98540 59923",info@pragatizone.com,http://www.pragatizone.com/index.php?dir=1
"Karavali Group Of Colleges Contact Number, Address & Location Map, Mangalore",0824-2455656,info@karavalicollege.ac.in,https://karavalicollege.com/,"Karavali CollegeN.H. 17, Near Kottara Chowki JunctionBangrakuloor, KodikalMangalore, Karnataka"
"Nirmala Group Of Institutions Contact Number, Address & Location Map, Thrissur",0480 - 2709093,info@nirmalacollege.in,http://www.nirmalacollege.in/Engineering/,NIRMALA COLLEGE OF ENGINEERINGNutmeg GardensMeloorKunnappilly P.O.ChalakkudyThrissur Dist.PIN:680311
"Amity University (AIHC), Noida Contact Number, Address & Location Map, Noida",0120 244 5252,admissions@amity.edu,http://amity.edu/aibhas/default.asp,"Amity University Noida Campus Sector-125, Noida - 201313 (U.P.)"
"Desh Bhagat University Contact Number, Address & Location Map, Fatehgarh Sahib",+91-82838-11111,contact@deshbhagatuniversity.in,http://www.deshbhagatuniversity.in,"Desh Bhagat University, Off to NH1,  Mandi Gobindgarh, District Fatehgarh Sahib, Punjab- 147301 India"
"CSJMU Contact Number, Address & Location Map, Kanpur","2583280, 2580044",csjmu@kanpuruniversity.org,http://www.csjmuniversity.co.in/,"CSJM University, Kanpur"
"Manav Rachna University Contact Number, Address & Location Map, Faridabad","+91-129-4268500, +91-129-4259000",admissions@manavrachna.edu.in,http://www.manavrachna.edu.in,"Sector 43, Aravalli Hills, Delhi, Surajkund Road, Faridabad-121004, (Haryana), India"
"Guru Kashi University Contact Number, Address & Location Map, Bathinda","+91-9914286400, +91-9914283400",info@gurukashiuniversity.in,http://www.gurukashiuniversity.in,"Guru Kashi University, Sardulgarh Road, Talwandi Sabo,Bathinda(Punjab)-151302"
"IEC University Contact Number, Address & Location Map, Solan","+91-9459898200, +91-7832902935",enquiry@iecuniversity.com,http://www.iecuniversity.com,"Atal Shiksha Nagar, (Kallujhanda), Near-Village Nanak Pura, Pinjore-Nalagarh Highway, District:- Solan, Himachal Pradesh-174103 (India)"
"Gautam Buddha University Contact Number, Address & Location Map, Kannauj",+91-120-2344200,http://www.gbu.ac.in,"Yamuna Expressway, Greater Noida Gautam Budh Nagar Uttar Pradesh (India) - 201308"
"Mandsaur University Contact Number, Address & Location Map, Mandsaur","+91-9425107457,+91-9752122999",dosa@meu.edu.in,http://www.mandsauruniversity.edu.in,"Mandsaur University  By Pass Square, Revas Devda Road,  S.H.-31, Mandsaur (M.P) -458001"
"Himgiri Zee University Contact Number, Address & Location Map, Dehradun",8171819966,director.admissions@hzu.edu.in,https://www.hzu.edu.in/,"Himgiri Zee University P.O. - Sherpur, Chakrata Road Dehradun, Pin - 248197 (Uttarakhand) INDIA"
"Asra Group Of Institutions Contact Number, Address & Location Map, Sangrur",01672-265727,asracollege27@gmail.com,http://www.asracollege.edu.in/asra_educationcollege.html,"Patiala-Sangrur Highway, P.O. Nidampur, Near Channo, Bhawanigarh, Distt. Sangrur (Punjab)"
"Atharva Group Of Institutions Contact Number, Address & Location Map, Mumbai",02240294941,achmct@atharvaeducation.com,http://www.atharvamumbai.com/,"AET Complex, Malad-Marve Road, Charkop Naka, Malad(W), Mumbai-400095, Maharashtra, India"
"Camellia Group Of Colleges Contact Number, Address & Location Map, Birbhum",(03463)271353/4,director@bitm.org.in,http://bihm.camelliagroup.in/,SANTINIKETAN SRINIKETAN BYPASS P.O.-DWARANDAWEST BENGALPIN-731236
"Chaitanya Group Of Colleges Contact Number, Address & Location Map, Warangal",870-2552555,cpreddycpreddy@gmail.com,http://pharmacy.chaitanyacolleges.com,"Kishanpura, Hanamkonda, Warangal 506 001, (A.P.) INDIA"
"IIMT University Contact Number, Address & Location Map, Meerut","+91-1212793500/507,+91-9997089170",mail@iimtindia.net,http://www.iimtu.com,"IIMT Nagar, u2018Ou2019 Pocket, Ganga Nagar Colony, Mawana Road, Meerut(U.P.)"
"University of Engineering & Management (UEM), Jaipur Contact Number, Address & Location Map, Jaipur","+91-9887313330, +91-9887933330",admissions@iemcal.com,http://www.uem.edu.in,"Gurukul,'Jaipur-6 Kms. From Chomu on Sikar Road (NH-52), Jaipur-303807, Rajasthan"
"Icl Group Of Colleges Contact Number, Address & Location Map, Ambala",086070 02229,directorgen@iclhitech.com,http://www.iclhitech.com/Barchitecture.aspx,AmbalaHaryana 134202
"Naincy Group Of Colleges Contact Number, Address & Location Map, Nainital",05942 - 224516,http://www.naincygroup.com/hotel_into.php,"Naincy Campus, Jeolikote Nainital,Uttaranchal"
"Mumbai Group Of Colleges Contact Number, Address & Location Map, Mumbai",2318326,http://mkctedu.com/,"KALYAN-BHIWANDI ROAD,NEAR PETROL PUMP,KALYAN(W) - 421 301"
"Quantum University Contact Number, Address & Location Map, Roorkee","+91-18002743014, +91-7308080803, +91-7308080804",admissions@quantumuniversity.edu.in,http://www.quantumuniversity.edu.in,Mandawar (22 Km milestone)  Roorkee - Dehradun Highway (NH 73) Roorkee # 247167 Uttarakhand India.
"ST. MARY'S COLLEGE OF ENGINEERING & TECHNOLOGY Hyderabad Contact Number, Address & Location Map, Hyderabad",asecpatancheru2006@gmail.com,http://www.stmarysgroup.com
"SAMS Varanasi Contact Number, Address & Location Map, Varanasi",sksingh.ganesh@gmail.com,http://www.samsvaranasi.com
"Rayat Bahra University Contact Number, Address & Location Map, Mohali","+91-160-5009675, +91-9780040777, +91-8054604707",info@rayatbahra.com,http://www.rayatbahrauniversity.edu.in,"Chandigarh-Ropar NH 205, Greater Mohali, Punjab"
"CT Group of Institutions Contact Number, Address & Location Map, Jalandhar",+91-181-5009595,info@ctgroup.in,http://www.ctgroup.in,"Shahpur, Po-Udopur, Near Lambra, Jalandhar -144020  Punjab, INDIA"
"Jiwaji University Contact Number, Address & Location Map, Gwalior",91 751 2442712,info@idejug.org,http://www.jiwaji.edu,"Jiwaji University, Gwalior (M.P.), India"
"Wlci Delhi Contact Number, Address & Location Map, Delhi",011 - 43199217,delhi@wlci.in,http://www.wlcidesign.in/programmes.php-0,160B Western AvenueSainik FarmsKhanpurDelhi - 110062
"Bhagat Phool Singh Mahila Vishwavidyalaya Contact Number, Address & Location Map, Sonepat",+ 91 01263-283038. 283154,enquiry@bpswomenuniversity.ac.in,http://www.bpswomenuniversity.ac.in/,"Department of Economics, B.P.S. Mahila Vishwavidyalaya, Khanpur Kalan, Haryana, Pin-  131305, India"
"Bhagwan Mahavir Group Of Colleges Contact Number, Address & Location Map, Surat",bmca.architecture@gmail.com,http://www.bmefcolleges.edu.in
"Jis Group Of Institutions Contact Number, Address & Location Map, Kolkata","09432012562, 9432011486, 8697743363, 9073370470","info@jisgroup.org, admission@jisgroup.org",http://www.jisgroup.org,"JIS Group Educational Initiatives, 1st floor, Dwarka Building, Sarat Bose Rd, Sector I, Sreepally, Bhowanipore, Kolkata, West Bengal 700020"
"Maharishi Arvind Group Of Institutions Contact Number, Address & Location Map, Jaipur",maism@datainfosys.net,http://www.maism.org
"People'S University Contact Number, Address & Location Map, Bhopal","+91-755-4005203, +91-755-4005421","info@peoplesuniversity.edu.in,hoi.management@peoplesuniversity.edu.in",http://www.peoplesuniversity.edu.in,"People's University, Peoples Campus, Bhanpur Bypass Road, Bhanpur, Bhopal"
"Padmashree Group Of Institutions Contact Number, Address & Location Map, Bengaluru",08023211099,pgibangalore@gmail.com,http://www.padmashree.org,"Padmashree Institute of Nursing, Nagarbhavi Circle, Bangalore, Karnataka, India-560072"
"Seacom Skills University Contact Number, Address & Location Map, Birbhum","+91-9836295315, +91-7890502451",info_ssu@seacomgroups.com,http://www.seacomskillsuniversity.org,"Kendradangal, Bolpur District: Birbhum, West Bengal India, PIN: 731236"
"The Neotia University Contact Number, Address & Location Map, Kolkata",+91-7044446999/+91-7044446888,contact@tnu.in,http://www.tnu.in,"Jhinga, Satrisa, D H Road, 24 Rgs(S)"
"SRM UNIVERSITY Ghaziabad Contact Number, Address & Location Map, Ghaziabad",+91-1232-234301,director@ncr.srmuniv.ac.in,http://www.srmuniv.ac.in/ncr/
"Rashtrasant Tukadoji Maharaj Nagpur University Contact Number, Address & Location Map, Nagpur",+91-712-2500736,registrar@nagpuruniversity.nic.in,https://www.nagpuruniversity.ac.in/v2/,Rashtrasant Tukadoji Maharaj Nagpur University  Chhatrapati Shivaji Maharaj Administrative Premises  Ravindranath Tagore Marg Nagpur 440001
"Pacific University Contact Number, Address & Location Map, Udaipur","+91-9672970940, +91-294-3065000, +91-9672978030, +91-9672978032",info@pacific-university.ac.in,http://www.pacific-university.ac.in,"Pacific Hills, Pratapnagar Extn., Airport Road, Debari,Udaipur - 313003"
"VELS University Chennai Contact Number, Address & Location Map, Chennai",+ 91 - 44 - 2266 2500 / 2501 / 2502 / 2503,vistas@velsuniv.ac.in,http://www.velsuniv.ac.in,"Velan Nagar P.V. Vaithiyalingam Road Pallavaram Chennai - 600 117 Tamil Nadu, India"
"Hindustan Institute of Technology and Science (HU, HU Chennai, Hindustan University, Hindustan University Chennai, Hindustan Chennai), Chennai Contact Number, Address & Location Map, Chennai","44-2747 4262, 2747 4395",info@hindustanuniv.ac.in,https://hindustanuniv.ac.in,"Rajiv Gandhi Salai (OMR), Padur,  (Via) Kelambakkam, Chennai - 603 103`"
"Baddi University Contact Number, Address & Location Map, Solan","+919816006185 ,91+17807771336",admissions@baddiuniv.ac.in,http://www.baddiuniv.ac.in,"Makhnumajra, Baddi Distt. Solan, H.P.-173 205"
"Hindusthan Group Of Institutions Contact Number, Address & Location Map, Coimbatore","+91-4224440555, +91-422 - 4440502, +91-98431 33333, +91-99433 44433",info@hindusthan.net,http://www.hindusthan.net,"Hindusthan Gardens, (Behind Nava India) Avanashi Road, Coimbatore - 641 028, TamilNadu, India."
"Hrit Group Of Institutions (HRIT), Ghaziabad Contact Number, Address & Location Map, Ghaziabad",+91-01202679173,admission2013@hrit.ac.in,http://www.hrit.ac.in,"7th Km Stone, Delhi-Meerut Road, Morta, Ghaziabad-201003 (U.P)"
"Maya Group Of Colleges Contact Number, Address & Location Map, Dehradun","+91-1352698602,+91-7351441144",info@maya.edu.in,http://www.mayagroup.org.in,"NH-72, Near Hotel The Competent Palace Chakrata Road, Selaqui, Dehradun (Uttarakhand) -248011"
"Mahatma Gandhi Vidyamandir Contact Number, Address & Location Map, Nasik",02591222342,manmad_college@rediffmail.com,http://www.mgv.org.in/,"Manmad,Tal. Nandgaon. Dist. Nashik"
