College Name,Contact no,Email,Website,Address
"Westwood Institute of Hotel Management Contact Number, Address & Location Map, Mohali",wwihm@rediffmail.com,http://westwoodinstitutes.com,"WESTWOOD INSTITUTE OF HOTEL MANAGEMENT,Zirakpur-Panchkula Highway,Adjoining Sector-20, Panchkula,Vill: Kathgarh, P.O: Dhakauli,Teh. Derabassi, Distt. Mohali,Punjab"
"Institute of Hotel Management (IHM), Hazipur Contact Number, Address & Location Map, Hazipur",06224-275354,hajipurihm@gmail.com,http://www.ihmhajipur.net,"Institute of Hotel Management Catering & Nutrition, Ramashish Chowk, Hajipur – 844 101, Vaishali, Bihar"
"New Delhi YMCA Institute For Media Studies & Information Technology Contact Number, Address & Location Map, New Delhi",011 - 43644000,ymcand@del3.vsnl.net.in,http://newdelhiymca.in/imsit.php,"Jai Singh Road , New Delhi, Delhi, India - 110001"
"MGM Patna Contact Number, Address & Location Map, Patna",91-612-2361381,info.college@mgmpatna.org,http://mgmpatna.org,Main Road Kankarbagh Opp Chandan Automobile  Patna - 800020 Bihar
"Indian Institute Of Hardware Technology Ltd. (IIHT), New Delhi Contact Number, Address & Location Map, New Delhi",011-42384000,gtbnagar@iiht.com,http://www.iiht.com/,"Plot No. 33 & 35, Mall Road, GTB Nagar, Kingsway Camp, Delhi-110009"
"Indian Institute Of Hardware Technology Ltd. (IIHT), Faridabad Contact Number, Address & Location Map, Faridabad",0120-4160148,info@iiht.com,http://www.iiht.com/,"SCF-69, 1st Floor, Sector-16(a) Market, Opposite Nehru College, Faridabad, Haryana, India- 121002"
"Salesian College Contact Number, Address & Location Map, Darjeeling",scssdb@salesiancollege.net,http://www.salesiancollege.in/,"Salesian College Sonada Campus,Sonada - (Post),Darjeeling - (Dist).,West Bengal - 734209, INDIA. - See more at: http://letsreach.com/salesian/website/Contact%20Us.html#sthash.kbc5FPj0.dpuf"
"ISC Pune Contact Number, Address & Location Map, Pune","+91-02-066759449,  +91-9049389234",isc@indiraedu.com,http://indiraisc.edu.in/,"85/5-B, Samanvay IT Campus, New Pune-Mumbai Highway, Tathwade, Pune-411033, Maharashtra, India"
"South Travancore Hindu College Contact Number, Address & Location Map, Nagarcoil",91-4652-225940.,sthinducollege@gmail.com,http://sthinducollege.com/,S.T.Hindu CollegeNagercoil-2Pin: 629 002
"NIA Delhi Contact Number, Address & Location Map, Delhi",09871565565,admissions@niaindia.org,http://www.niaindia.org/,"Admission Office: ,A-1, Forest Lane, M.G. Road,New Delhi"
"National Institute of Event Management (NIEM), Pune Contact Number, Address & Location Map, Pune",+91 20 2567 9034,niem.events@gmail.com,http://www.niemindia.com/,"4, Kamal Prabha Apts, Opp. Police ground,Next to Corn Club, F.C. Road Pune,Maharashtra 411 016"
"National Academy of Event Management & Development (NAEMD), Ahmedabad Contact Number, Address & Location Map, Ahmedabad",(079)3008 1829,ahmedabad@naemd.edu.in,http://www.naemd.com,"- 24, Samudra Complex,Near Hotel Klassic Gold,Off C.G. Road, Navrangpura, Ahmedabad - 380009, Gujarat."
"ROOTS Collegium Contact Number, Address & Location Map, Hyderabad",+91-8978892570,rootsacademics2011@gmail.com,http://www.roots.ac.in,"Adjacent to Katriya Hotel , Raj Bhavan Road, Somajiguda, Hyderabad, Andhra Pradesh, India - 500 082"
"JHC Mumbai Contact Number, Address & Location Map, Mumbai","+91-22-22041095 , +91-22-22040256",contactus@jaihindcollege.com,http://www.jaihindcollege.com,"A Road, Churchgate, Mumbai , Maharashtra, India - 400 020"
"Om Paramedical & Technical Education Contact Number, Address & Location Map, New Delhi",011-45605470,opte.delhi@gmail.com,http://www.optedu.in,"A-26, First Floor, Palam Extension ,SBI Wali Gali, Opp. Children Park & Max Fort School ,Sector - 7 ,Dwarka, New Delhi-110075,Nearest Metro Station: Dwarka, Sector-10"
"ISB Kolkata Contact Number, Address & Location Map, Kolkata",03340101200,admissions@isb.ac.in,http://www.isb.ac.in/,"PTI Building, 8th Floor , DP-9, Sector-V, Salt Lake City, Kolkata, West Bengal, India - 700091"
"National Institute of Management (NIM), Durgapur Contact Number, Address & Location Map, Durgapur",91 (343) 254480,info@dms.nitdgp.ac.in,http://www.nimdurgapur.org/,"NIT Durgapur, Mahatma Gandhi Avenue, Durgapur - 713209, West Bengal, India."
"UEI Global (UEI), Lucknow Contact Number, Address & Location Map, Lucknow",info@uei-global.com,http://www.uei-global.com/bba_mba_hotel_management_institute_business__school_college_lucknow.aspx,"2 Floor, TC-57 V, Shalimar Tower, Vibhuti Khand, Gomti Nagar, Lucknow, Uttar Pradesh, India- 226016"
"S. S. & L. S. Patkar College of Arts & Science & V. P. Varde College of Commerce & Economics Contact Number, Address & Location Map, Mumbai",+91-22-2872 3731 / 2872 1875,info@patkarvardecollege.edu.in,http://www.patkarvardecollege.edu.in/,"S. V. Road, Goregaon (West),Mumbai - 400062"
"IHRM Kolkata Contact Number, Address & Location Map, Kolkata",033 2434 6885,admissions@ihrmedu.org,http://ihrmedu.org,"Sonargaon Park, Tegharia, Sonarpur, Kolkata 700150"
"Rawal Institute of Management Contact Number, Address & Location Map, Faridabad",0129-2400400,info@rawalinstitutions.com,http://www.riom.in/,"Sohna Road, Near Zakopur, Faridabad"
"EBS Mumbai Contact Number, Address & Location Map, Mumbai","+91 9324656222, +91 8652258515",anil@ebsmumbai.com,http://ebsmumbai.com/,"Y-A Block, APMC, Sector 19B, Next to Avalon Heights School, Near RTO, Opp Ambience Court, Sector-19-B, Vashi, Navi Mumbai- 400705"
"IISD Kolkata Contact Number, Address & Location Map, Kolkata",033-2335-2861,iisdedu@gmail.com,http://iisdedu.in/,"INSTITUTE FOR INSPIRATION & SELF DEVELOPMENT, IB - 200/1, Sector - III, Salt Lake, Kolkata-700 106, West Bengal, India"
"UEI Global (UEI), Faridabad Contact Number, Address & Location Map, Faridabad",011 - 44151515,info@uei-global.com,http://www.uei-global.com/bba_mba_hotel_management_institute_business__school_college_faridabad.aspx,"4 Floor, Crown Plaza, Sector- 15 A, Delhi - Mathura Road, Faridabad - 121007"
"Dr. Narayana College of Hotel Management Contact Number, Address & Location Map, Secunderabad",+91-9666365365,nchm.bm@gmail.com,http://drngmi.com/,"Dr. Narayana Degree College Of Hotel Management, Kistamma Complex, Old Alwal, Secunderabad"
"AIMS Education Campus (AIMS), Anand Contact Number, Address & Location Map, Anand",02692-239247,info@aims.ac.in,http://aims.ac.in,"Bakrol Vadtal Rd Anand, Gujarat 388315India"
"Delhi Institute of Management & Technologies (DIMT), New Delhi Contact Number, Address & Location Map, New Delhi",011-47481700,http://dimtedu.com/,"Plot No. 2, Tehsil Road, Chara Mandi, Najafgarh, New Delhi - 110043."
"Theem College of Engineering Thane Contact Number, Address & Location Map, Thane",+91-02525-284909,info@theemcoe.org,http://www.theemcoe.org/,"Boisar Chilhar Road, Boisar (E),Tal.: Palghar, Dist - Thane."
"A S Educare Institute Contact Number, Address & Location Map, Kolkata",admission@aseducare.com,http://www.aseducare.com,"3 No. Airport Gate ,P.O.-Rajbari, Kolkata -700081,West Bengal, India"
"ILEAD Kolkata Contact Number, Address & Location Map, Kolkata",+91-9163122222,contact@ilead.net.in,http://www.ilead.net.in,"113 J Matheswartola Road, Near Axis Bank, Off Park Regency Hotel, Topsia, Kolkata, West Bengal 700046"
"DDC Delhi Contact Number, Address & Location Map, Delhi",info@delhidegree.com,http://www.delhidegree.com/ddc.aspx,"D-17, 3rd Floor, Bareja Sadan, Main Mathura Road, Badar Pur Metro Station, Badarpur, Delhi, Delhi, India- 110044"
"St.Mary's College Contact Number, Address & Location Map, Bengaluru",080 - 25200 130,info@saintmarys.in,http://www.saintmarys.in/index.aspx,"39/1, 7th Main Road,, Indiranagar, parallel to ESI Hospital, HAL 2nd Stage, Bangalore, Karnataka, India- 560038"
"Siddhpura Institute of Management & IT Contact Number, Address & Location Map, Ahmedabad",079-40306030,info@simit.in,http://simit.in,"Siddhpura Complex Opp.Axis Bank, Krishnabag Maninagar Ahmedabad-380008, Gujarat."
"Indian Business School of Advanced Management Studies Contact Number, Address & Location Map, Mumbai",+91-022-42310000,info@ibsams.com,http://www.ibsams.com/,# 801Business Square8th FlooMadhavdas Amarshi RoadOpp. Andheri Station West Platform No. 6Andheri WestMumbaiMaharashtraIndia- 400058
"Noble Institute of Professional Studies Contact Number, Address & Location Map, Delhi",011-27443377,info@nipsedu.in,http://nipsedu.in,"13, Central market, Ashok Vihar, Delhi- 110052"
"International Centre for Distance Education and Open Learning Contact Number, Address & Location Map, Simla",0177-2832239,info@icdeolhpu.org,http://icdeolhpu.org/,"Summer Hill , Shimla - 171005"
"Universal Institute Of Management And Technology Contact Number, Address & Location Map, Mohali",0172-6530780,spain@uimtonline.com,http://www.uimtonline.com,"Mohali, SCF - 76-77 , 1st floor,Phase - 11, Mohali (Punjab) INDIA - 160062."
"Avalon Business School (ABS), Visakhapatnam Contact Number, Address & Location Map, Visakhapatnam",info@avalonbusinessschool.com,http://avalonbusinessschool.com/,"GK Towers, Dwarakanagar Rd, Sagar Nagar, Dwaraka Nagar, Visakhapatnam, Andhra Pradesh 530016"
"Srishti Academy Contact Number, Address & Location Map, Ghaziabad",9582346100,srishti-academy@outlook.com,http://srishtiacademy.co.in/,"Plot No.-1200, Sector-13, Near Punjab National Bank,Vasundhara, Ghaziabad, Uttar Pradesh, India- 201012"
"NSB School of Management Studies Contact Number, Address & Location Map, Bengaluru",080-41124446,admission.bangalore@nsb.in,http://www.nsb.in/bangalore,"NSB, No.-43/3, Concord Arcade, Kudlu Gate Main Road, Off Hosur Road, Land Mark-Near TVS Godown, Bangalore-560068"
"Xaviers Institute of Business Management Studies Contact Number, Address & Location Map, Bengaluru",080-30577207,info@xibms.com,http://www.xibms.com/,1st and 2nd FloorJBA complexHouse No. 1678A60 Feet Nehru RoadNext to NIITKammanhalliBangalore - 560084
"GTA Pune Contact Number, Address & Location Map, Pune",020 640 567 88,info@tgtacareers.com,http://www.tgtacareers.com,"1st Floor, 1233, Sai Chaya, Apte Road, Deccan, Opp. Kohinoor Executive Hotel,Above IDBI Bank ATM, Pune  411 004"
"Aptech Aviation and Hospitality Academy (AAHA), Bangalore Contact Number, Address & Location Map, Bengaluru",http://www.aptechaviationacademy.com,"1ST FLOOR, VIKAS TOWERS, No.36 CASTLE STREET,OFF. BRIGADE ROAD, NEAR NARAYANA NETRALAYA, ASHOK NAGAR"
"B D Somani Institute Of Art And Fashion Technology Contact Number, Address & Location Map, Mumbai",22155731,info@bdsomani.com,http://www.bdsomani.com/,"G.D Somani Memorial School, Cuffe Parade, PIN- 400005"
"Shanti Devi Arya Mahila College Contact Number, Address & Location Map, Gurdaspur",01875-220344,sdamcollege_dnn@yahoo.com,http://www.shantidevicollege.org/index.aspx,"Batala Road, Dinanagar, Gurdaspur, Punjab, India"
"Ethiraj college for women Contact Number, Address & Location Map, Chennai","+(91)-44-28279189 , +(91)-44-28287210, +(91)-44-28240592",ethirajprincy@yahoo.com,http://www.ethirajcollege.in/,"70, Ethiraj Salai, Egmore, Thousand Lights, Chennai, Tamil Nadu 600008"
"Center For Management Studies, Dibrugarh University Contact Number, Address & Location Map, Dibrugarh",+91-373-2101423,contact@cmsdu.org,http://www.cmsdu.org/,"Centre for Management Studies,Dibrugarh University,Dibrugarh 786004,Assam, India"
"H.R. College of commerce and economics Contact Number, Address & Location Map, Mumbai",+91 22 22876115 / 22042195,info@hrcollege.edu,http://www.hrcollege.edu/,123Dinshaw Wachha RoadChurchgateMumbai 400 020 India
"RCM Bhubaneswar Contact Number, Address & Location Map, Bhubaneswar","+91-18001214357, +91-9090080801",Admission@Rcm.Ac.In,http://www.rcm.ac.In,"Rcmt Campus 1, Rcm Lane, Plot No. Gd 2/ 12 & 13, Chakadola Vihar, Chandrasekharpur, Bhubaneswar, Odisha- 751023"
"Little Flower College Contact Number, Address & Location Map, Guruvayoor",+91 4872556957,enquiry.lfp@gmail.com,http://littleflowercollege.edu.in,"Guruvayoor - 680 103 Kerala, India"
"IIAS School of Management (IIAS), Kolkata Contact Number, Address & Location Map, Kolkata",iias.kolkata@iias.org.in,http://iias.org.in/,"AC - 93/A, Prafulla Kanan (E), V.I.P. Road, Kolkata, West Bengal, India- 700101"
"GBS Delhi Contact Number, Address & Location Map, Delhi",9312510111,info@govindam.org,http://www.govindam.org/,"514, Industrial Estate Patparganj, (Near Anand Vihar Metro Station, Opposite East Delhi Mall), Delhi 110092"
"Shri Shakti College of Hotel Management Contact Number, Address & Location Map, Hyderabad",040-66906504,ihmshrishakti@gmail.com,https://sschm.com/,"Venus Plaza, Adjacent to Hotel Fortune Select Manohar, Begumpet, Hyderabad, Telangana, India-500016"
"NIMAS Contact Number, Address & Location Map, Kolkata","+91-9874669007, +91-9874641007",nimas.admission@gmail.com,http://www.nimas.in,"HL NO- 1045/1/A, Barasat Barrackpore Road,  Ward No. 4, Behind Lokenath Mandir  Kolkata"
"Nimt Mahila Technical College for Hotel Management and Catering Technology Contact Number, Address & Location Map, Greater Noida",+91 9555 192192,admissions@nimtgroup.edu.in,http://nimt.ac.in/course/hospitality/bhmct-bachelor-hotel-management-catering/,"Plot No. 41, Kasna Road, Near Pari Chowk, Distt.Gautam Buddha Nagar, Greater Noida, Uttar Pradesh, India- 201310"
"IABM Bikaner Contact Number, Address & Location Map, Bikaner",+911512252981,director@iabmbikaner.org,http://www.iabmbikaner.org,Agricultural UniversityBichhwalBikanerRajasthan 334006
"Abhi Institute Of Hotel Management (AIHM), New Delhi Contact Number, Address & Location Map, New Delhi",+91-971494317,admin@abhiinstitute.com,"E-1065, Near Dwarka Sector-7, Palam Extension Rampal Chowk, Opp. Msk Building, New Delhi-110077"
"CIIMS Nagpur Contact Number, Address & Location Map, Nagpur",07126697800,nagpur@ciimsindia.com,http://www.ciimsindia.com/,"35, Deviprabha Pride, ,2nd Floor, Cement Road Shivaji Nagar,Nagpur - 440 010 (MS)"
"Sankar Institute of Science Technology and Management Contact Number, Address & Location Map, Kollam",04742596200,contact@rsankarsociety.com,http://sankarinstitute.org/,"Tazham South, Chathannoor P.O , Kollam, Kerala, India - 691 572"
"RIMT Mandi Gobindgarh Contact Number, Address & Location Map, Mandi Gobindgarh",info@rimt.ac.in,http://www.rimt.ac.in/school-of-management-studies.php,Opposite Floating RestaurantSirhind SideMandi Gobindgarh-147301Punjab (INDIA)
"DCET Dungarpur Contact Number, Address & Location Map, Dungarpur",0912964291654,info@dungarpurengineering.org,http://www.dungarpurengineering.org/index.php,"Bhandariya Ghata, Simalwada Road, Dungarpur, Rajasthan - Other, Rajasthan, India- 314001"
"Punjab Institute of Management & Technology Contact Number, Address & Location Map, Gobindgarh",081960 53007,enquiry@pimt.info,http://pimt.in/,"Near GPS Campus, GT Road, Alour, Khanna, Punjab 147301"
"RK Institute of Management & Computer Science Contact Number, Address & Location Map, Bengaluru",080 2552 1806,rket@rket.org,http://snsvo7.seekandsource.com/rkinstituteofmanagement/,"No.13, Sy No.19, Ambalipura Bellandur Gate , Karnataka, Bangalore, Karnataka, India- 560037"
"Dr Ambedkar Institute Of Technology For Handicapped (AITH), Kanpur Contact Number, Address & Location Map, Kanpur",0512-2583221,aith_knp@rediffmail.com,http://aith.ac.in,Dr. Ambedkar Istitute of Technology  For Handicapped U.P. rnAwadhpuri Kanpur Opposite to Rama Dental College
"Rukmani devi Institute of Science & Technology Contact Number, Address & Location Map, Bhopal",09977034448,rdistbpl@gmail.com,http://www.rukmanidevi.org/about_rdist.html,"Salaiya Road, Misrod"
"SEC Kolkata Contact Number, Address & Location Map, Kolkata",+91-8981024702,admission@seacomengineering.org,http://www.seacomengineering.org,"JL-Jaladhulagori(via Andul Mouri) ,Sankrail Howrah - 711302 West Bengal , India"
"M.K. Ponda College Of Business & Management Contact Number, Address & Location Map, Bhopal",0755-2854711,principal@mkpondacollege.org,http://www.mkpondacollege.org/,"M.K. Ponda College, Lambakheda, Near Nabibagh,Berasia Road, Bhopal, Madhya Pradesh, India-462038"
"GBS Greater Noida Contact Number, Address & Location Map, Greater Noida",9582847072,info@galgotiasbschool.in,http://galgotiasbschool.in/,"Plot No.2, Sector 17-A Yamuna Expressway, Greater Noida, Gautam Buddh Nagar, Uttar Pradesh, India"
"SAST Delhi Contact Number, Address & Location Map, Delhi",011-24618931,info@delhiflyingclub.org,http://www.delhiflyingclub.org/about-sast.html,"Delhi Flying Club Ltd.,Safdarjung Airport, New Delhi-110003"
"Chilkur Balaji Institute of Technology Contact Number, Address & Location Map, Hyderabad",04032572794,tap.cbtv@gmail.com,http://cbtv.ac.in/,"R.V.S Nagar,Moinabad Road,Near AP Police Academy,9km From Mehdipatnam,Hyderabad - 500075.,Andhra Pradesh,India."
"Shyam Institute of Engineering & Technology Contact Number, Address & Location Map, Dausa","+91-1431-213145, 213146,+91-8890202999, +91-8890207999",shyamcollege@gmail.com,http://www.sietdausa.com,"Dehlal – Deedwana, Tehsil Lalsot Distt. Dausa, Rajasthan (India)"
"Gokaran Narvadeshwar Institute Of Technology & Management Contact Number, Address & Location Map, Lucknow",05248-262624,http://www.gnitm.org,"12, Km. Stone on Lucknow-Dewa Road, 6 Km. Ahead of Telco  Tindola   Dist. Barabanki (U.P.) INDIA"
"Stani Memorial College of Engineering & Technology, Jaipur Contact Number, Address & Location Map, Jaipur",+91-1412395402,smcetjaipur@rtu.ac.in,http://www.smcet.in,"IIRM Phagi Campus, Phagi, Rampura Road, Jaipur, Rajasthan 303005"
"Vivekananda Institute of Technology & Science (VITS), Ghaziabad Contact Number, Address & Location Map, Ghaziabad",+91-120-2677808,information@vitsgzb.com,https://www.facebook.com/groups/vitsknr/,"Vivekanand Institute of Technology & Science,Delhi-Hapur Road ,NH-24, Jindal Nagar, Ghaziabad ,Uttar Pradesh-201302"
"ASCI Hyderabad Contact Number, Address & Location Map, Hyderabad",+91-40-66533000,pgdhm@asci.org.in,http://www.asci.org.in/,Administrative Staff College of IndiaCollege Park CampusBanjara Hills Road #3Hyderabad 500034
"QUBA College of Engineering & Technology Nellore Contact Number, Address & Location Map, Nellore",0861-2383531,quba786@yahoo.co.in,http://www.qubacollege.in,"VENKATACHALAM, KANPUR BIT-I NELLORE - 524320"
"Sri Venkateswara College of Engineering & Technology Chittoor Contact Number, Address & Location Map, Chittoor",info@svcetedu.org,http://www.svcetedu.org,"R.V.S. Nagar, Tirupati Road, Chittoor - 517 127. Andhra Pradesh. India."
"Sri Krishnadevaraya Engineering College Contact Number, Address & Location Map, Anantapur",08552-260666,skdgooty@gmail.com,http://www.skdengg.com,"NH-44, Gooty,Anantapur(Dist), Andhra Pradesh, PIN:515401."
"Vivekananda Institute of Technology & Science (VITS), Hyderabad Contact Number, Address & Location Map, Hyderabad",0878-6503861,vitscollegeknr@gmail.com,http://www.vits.ac.in,"Opp: Housing Board Colony,Karimnagar - 505001,Andhra Pradesh- INDIA"
"VBCE Hyderabad Contact Number, Address & Location Map, Hyderabad",040 - 231 555 3,advbce@gmail.com,http://www.vbce.ac.in,"Vishwa Bharathi College of Engineering, Nizampet , near JNTUH, Hyderabad."
"B.P.Marine Academy Contact Number, Address & Location Map, Navi Mumbai","022 - 69195959,833936814, +91-7710849574",bpmarinehotelmanagement@gmail.com,http://www.bpmarineacademy.in/,"B. P. Marine Academy, Sai pooja Chambers, Belapur East, Sector 11, CBD - Belapur, Navi Mumbai, Maharashtra - 400614"
"A.J. College of Science and Technology (AJCST), Thiruvananthapuram Contact Number, Address & Location Map, Thiruvananthapuram",+91-0471-2618106,ajcollegeprincipal@gmail.com,http://www.ajcollege.in,"Thonnakkal, Thriruvananthapuram,Kerala – 695 317"
"A&M Institute of Computer & Technology Contact Number, Address & Location Map, Pathankot",0186-2252086,director.amict@yahoo.com,http://www.amict.in,"Opp. Canada Palace , Jallandhar - Dalhosie ByePass Road, Vill. Mamoon , Pathankot,Pin - 145001, punjab."
"A.D.M.College for Women (ADMCW), Nagapattinam Contact Number, Address & Location Map, Nagapattinam",4365 248118,principal@adjadmc.ac.in,http://www.adjadmc.ac.in,"No. 1, College Road,Nagapatinam - 611 001."
"A.V Abdurahman Haji Arts & Science College Contact Number, Address & Location Map, Kozhikode",+91496 247 1004,principal.avahcollege@salafiedu.org,http://avahcollege.salafiedu.org,"Salafi Campus, Kuluppa,Payyoli Angadi P O - 673 523,Kozhikod District,Kerala, India"
"Madhuban Academy of Hospitality Administration & Research Contact Number, Address & Location Map, Dehradun",0135-2742500,enquiry@maharedu.com,http://www.maharedu.com,"97 - Rajpur Road, Dehradun - 248 001 Uttarakhand, INDIA"
"Integral University Contact Number, Address & Location Map, Lucknow",9335177775,iucat@iul.ac.in,http://www.iul.ac.in/,"u00a0Integral University, Kursi Rd, Lucknow, Uttar Pradesh 226026"
"Swami Rama Himalayan University Contact Number, Address & Location Map, Dehradun","+91-135-2471135, +91-8194009632",admissions@srhu.edu.in,http://www.srhu.edu.in,"Swami Rama Himalayan University,rnSwami Ram Nagar,rnPO u2013 Doiwala,rnDehradunrnUttarakhand-248 140"
"Subharti University Contact Number, Address & Location Map, Meerut",+91-121-2439043,subhartidentalcollege1@gmail.com,http://www.subharti.org,"Subharti Puram, NH-58, Delhi Haridwar by Pass Road, Meerut"
"Snehacharya Institute of Management And Technology Contact Number, Address & Location Map, Alappuzha",0479 2149026,snehamichael@yahoo.com,http://snehacharya.com/,"KARUVATTA NORTH,KARUVATTA P O,ALAPPUZHA- 690517, KERALA, INDIA."
"Yuvakshetra Institute of Management Studies Contact Number, Address & Location Map, Palakkad",0491-2846426,yuvakshetra@gmail.com,http://yuvakshetra.org,"Ezhakkad (PO),Mundur,Palakkad (District) - 678 631,Kerala, India,"
"Westin College of Hotel Management Contact Number, Address & Location Map, Vijayawada",+91-9396755766,info@westin.ac.in,http://www.westin.ac.in,"G V R Towers, Opp. Vinayak Theatre, Bharathi Nagar, Vijayawada - 520 008"
"Wada College of Management & Science Contact Number, Address & Location Map, Thane",02526   273938,wadacollege@gmail.com,http://wadacollege.com,"Wada College of Management & Science,Yashawant Nagar,At – Post – Tal : Wada,Dist : Thane,Pin : 421303"
"Vishweshwar Dayal Mahavidyalaya Contact Number, Address & Location Map, Sitapur",05863-211034,info@vdm.co.in,http://www.vdm.co.in,Konsar Chauraha Biswan Sitapur Uttar Pradesh -261201
"T.K. Madhava Memorial College Contact Number, Address & Location Map, Alappuzha",+914792412659,info@tkmmcollege.org,http://www.tkmmcollege.org/index.php,"T.K.Madhava Memorial College, Nangiarkulangara Post,Haripad, Alappuzha Dist,Kerala State, India,Pin: 690513."
"Vimala College Contact Number, Address & Location Map, Thrissur",+91-487-2332080,mail@vimalacollege.edu.in,http://www.vimalacollege.edu.in,Vimala CollegeThrissur-9KeralaIndia.
"St.Josephs Institute of Hotel Management and Catering Technology Contact Number, Address & Location Map, Palai",04822   239508,info@sjihmct.ac.in,http://www.sjihmct.ac.in,"Choondacherry P.O, Kottayayam, Bharananganam, Palai"
"St.Alberts College Contact Number, Address & Location Map, Ernakulam",0091-484-2394225,admission@alberts.ac.in,http://www.alberts.ac.in/,"Banerji Road, Ernakulam, Kochi - 682 018"
"St. Joseph's College for Women (SJCW), Visakhapatnam Contact Number, Address & Location Map, Visakhapatnam",0891 2558346,sjcwvizag@gmail.com,http://www.stjosephsvizag.com,"Gnanapuram, Waltair R.S. Visakhapatnam - 530004,Andhra Pradesh"
"St. Joseph's College for Women (STJCW), Alappuza Contact Number, Address & Location Map, Alappuza",0477-2244622,saitjbp@gmail.com,http://www.stjosephscollegeforwomen.org,ALAPPUZHA KERALA INDIA
"SCC bangalore Contact Number, Address & Location Map, Bengaluru",+91-80-23454755,claretcollege@gmail.com,http://www.claretcollege.edu.in,"P.O. Box 1355, M.E.S. Ring Road,Jalahalli, Bangalore 560 013, INDIA"
"St. Peters College Contact Number, Address & Location Map, Ernakulam",484-5598408,stpeterscollege12@gmail.com,http://www.stpeterscollege.ac.in,"Kolenchery - 682 311, Ernakulam District Kerala"
"St Xaviers College of Arts Science & Commerce Contact Number, Address & Location Map, Mapusa",0832-2262356,xavierscollege@bsnl.in,http://www.xavierscollege-goa.com,"P.O. Box No. 32, Mapusa, Bardez Goa, 403 507"
"Laxmi Memorial College of Hotel Management Contact Number, Address & Location Map, Mangalore",0824 2493882,laxmimemorial@yahoo.in,http://www.laxmimemorialchm.org,"4/9/T 857/3 Kalakunja Road, Next to Besant College, Opposite to M.G.,Road, Mangalore-575003 (KARNATAKA)"
"SRM Kanchipuram Contact Number, Address & Location Map, Kanchipuram","+91 44-27454863, +91 44-27454862",mail@srmasc.ac.in,http://www.srmasc.ac.in,SRM NagarKattankulathurKanchipuram Dt -603 203.
"St. Xaviers College Contact Number, Address & Location Map, Mumbai",022 22620661,webadmin@xaviers.edu,http://xaviers.edu,"5, Mahapalika Marg, Mumbai, Maharashtra 400 001"
"Sri Jeyandra Saraswathy Maha Vidyalaya College of Arts and Science Contact Number, Address & Location Map, Coimbatore",0422   2270411,info@srijayendracas.org,http://srijayendracas.org/,"182, SIHS Colony Road, Singanallur, Coimbatore, Tamilnadu, INDIA PIN: 641 005"
"Srisaila Jagadguru Vageesh Panditaradhya Mahaswamiji Contact Number, Address & Location Map, Davangare",08192 - 2442216,sjvp_hrh@yahoo.com,http://www.sjvpac.org,"P.B.ROAD VAGEESH NAGAR, Harihar Karnataka 577601 India"
"St. Michaels College Contact Number, Address & Location Map, Alappuzha",0478 2822387,enquiry@stmichaelscherthala.edu.in,http://www.stmichaelscherthala.edu.in,"Mayithara P.O., Cherthala Alappuzha Dt., Kerala PIN-688 539"
"Sri Kanyaka Parameswari Arts & Science College for Women Contact Number, Address & Location Map, Chennai",044-25387021,srikanyaka99@gmail.com,http://www.skpc.edu.in,"#1, AUDIAPPA STREET,PARRYS, CHENNAI - 600001."
"Sri Kaliswari College (Autonomous) Contact Number, Address & Location Map, Sivakasi",04562-232648,kaliswaricollege@gmail.com,http://www.kaliswaricollege.org,"Sivakasi,rnVirudhunagar Main Road,rnSivakasi - 626123, Tamilnadu,"
